Users comments,Keywords,Object,DOI
"We got comments like “Interface is user friendly”, “Causal network gives control and flexibility”, “Causal network is very intuitive and easy to understand”, “Causal network is a great way to understand relationships between features”","intuitive; easy, understand;",networks;,https://dx.doi.org/10.1109/TVCG.2022.3209484
"comments sorted under ""Visibility"" (from additional content of the paper):

Easy to find the names
Hard/confusing to find people
Everything is visible
I cannot see everything at once/I want to zoom out or summarization view
Summary of selections needed
Took too much space
Crowded view
Having a big map is convenient
Confusing to have several maps
It shows things better",easy; hard; confusing; visible; see; crowded; convenient; show,flows; maps; paths;,https://dx.doi.org/10.1109/TVCG.2022.3209480
"For the Func tasks, participants appreciate the design of glyphs. As P6 mentioned that “it (the glyph visualization) is intuitive and informative.” P14 added, “I do not need to look up the documentation of functions because glyphs explain all.” ",,tables; text; flow;,https://dx.doi.org/10.1109/TVCG.2022.3144975